{
  "schema_version": "1.0",
  "tool": "vmfleet",
  "profile": "Day2Smoke",
  "status": "Pass",
  "exit_code": 0,
  "proven_on_hardware": false,
  "started_at": "2026-10-15T10:00:00.0000000Z",
  "finished_at": "2026-10-15T10:15:00.0000000Z",
  "duration_seconds": 900,
  "run_id": "fixture-candidate-ok-002",
  "cluster_name": "example-cluster-01",
  "node_count": 4,
  "baseline_run_id": "fixture-baseline-001",
  "metrics": {
    "total_iops": 115500.0,
    "total_read_iops": 80850.0,
    "total_write_iops": 34650.0,
    "total_read_throughput_mbps": 647.57,
    "total_write_throughput_mbps": 277.53,
    "avg_latency_ms": 3.35,
    "avg_read_latency_ms": 2.68,
    "avg_write_latency_ms": 4.69,
    "total_throughput_mbps": 925.1
  },
  "checks": [
    {
      "metric": "iops_per_node",
      "kind": "min",
      "limit": 5000.0,
      "actual": 28875.0,
      "status": "Pass"
    },
    {
      "metric": "avg_latency_ms",
      "kind": "max",
      "limit": 25.0,
      "actual": 3.35,
      "status": "Pass"
    },
    {
      "metric": "total_throughput_mbps",
      "kind": "min",
      "limit": 100.0,
      "actual": 925.1,
      "status": "Pass"
    },
    {
      "metric": "total_iops",
      "kind": "regression",
      "limit": 10.0,
      "actual": -3.75,
      "status": "Pass"
    },
    {
      "metric": "total_throughput_mbps",
      "kind": "regression",
      "limit": 10.0,
      "actual": -1.64,
      "status": "Pass"
    },
    {
      "metric": "avg_latency_ms",
      "kind": "regression",
      "limit": 15.0,
      "actual": 4.69,
      "status": "Pass"
    }
  ],
  "notes": []
}
